{
  "$schema": "https://json-schema.org/draft/2020-12/schema",
  "$id": "https://kokorox.local/schemas/v1/character-source.schema.json",
  "type": "object",
  "additionalProperties": false,
  "required": [
    "schema_version",
    "artifact_id",
    "created_by",
    "character_id",
    "character_version",
    "namespace",
    "identity",
    "evidence",
    "derived_profile",
    "overrides",
    "behavior",
    "growth",
    "expressions",
    "locales",
    "scenarios"
  ],
  "properties": {
    "schema_version": {"const": "1.0"},
    "artifact_id": {
      "type": "string",
      "pattern": "^[a-z0-9][a-z0-9._/-]{0,127}(?![\\s\\S])"
    },
    "created_by": {"$ref": "#/$defs/created_by"},
    "character_id": {"$ref": "#/$defs/path_slug_id"},
    "character_version": {"$ref": "#/$defs/character_version"},
    "namespace": {"$ref": "#/$defs/path_slug_id"},
    "spoiler_scope": {"$ref": "#/$defs/bounded_string"},
    "identity": {"$ref": "#/$defs/identity"},
    "evidence": {"$ref": "#/$defs/evidence"},
    "derived_profile": {"$ref": "#/$defs/derived_profile"},
    "overrides": {"$ref": "#/$defs/overrides"},
    "behavior": {"$ref": "#/$defs/behavior"},
    "growth": {"$ref": "#/$defs/growth"},
    "expressions": {"$ref": "#/$defs/expressions"},
    "locales": {"$ref": "#/$defs/locales"},
    "scenarios": {"$ref": "#/$defs/scenarios"}
  },
  "$defs": {
    "created_by": {
      "type": "object",
      "additionalProperties": false,
      "required": ["component", "version"],
      "properties": {
        "component": {"const": "kokorox"},
        "version": {"type": "string", "minLength": 1, "maxLength": 64}
      }
    },
    "slug_id": {
      "type": "string",
      "minLength": 1,
      "maxLength": 64,
      "pattern": "^[a-z0-9]+(?:-[a-z0-9]+)*(?![\\s\\S])"
    },
    "path_slug_id": {
      "allOf": [
        {"$ref": "#/$defs/slug_id"},
        {
          "not": {
            "enum": [
              "con", "prn", "aux", "nul",
              "com1", "com2", "com3", "com4", "com5",
              "com6", "com7", "com8", "com9",
              "lpt1", "lpt2", "lpt3", "lpt4", "lpt5",
              "lpt6", "lpt7", "lpt8", "lpt9"
            ]
          }
        }
      ]
    },
    "semantic_id": {
      "type": "string",
      "maxLength": 128,
      "pattern": "^[a-z][a-z0-9]*(?:_[a-z0-9]+)*(?![\\s\\S])"
    },
    "character_version": {
      "type": "string",
      "minLength": 1,
      "maxLength": 64,
      "pattern": "^(0|[1-9][0-9]*)\\.(0|[1-9][0-9]*)\\.(0|[1-9][0-9]*)(?:-(?:0|[1-9][0-9]*|[0-9]*[A-Za-z-][0-9A-Za-z-]*)(?:\\.(?:0|[1-9][0-9]*|[0-9]*[A-Za-z-][0-9A-Za-z-]*))*)?(?:\\+[0-9A-Za-z-]+(?:\\.[0-9A-Za-z-]+)*)?(?![\\s\\S])"
    },
    "bounded_string": {
      "type": "string",
      "minLength": 1,
      "maxLength": 256
    },
    "string_array": {
      "type": "array",
      "minItems": 1,
      "maxItems": 32,
      "uniqueItems": true,
      "items": {"$ref": "#/$defs/bounded_string"}
    },
    "identity": {
      "type": "object",
      "additionalProperties": false,
      "required": ["display_name", "declared_age", "role", "non_negotiables"],
      "properties": {
        "display_name": {"$ref": "#/$defs/bounded_string"},
        "declared_age": {"$ref": "#/$defs/bounded_string"},
        "role": {"$ref": "#/$defs/bounded_string"},
        "worldview": {"$ref": "#/$defs/string_array"},
        "non_negotiables": {"$ref": "#/$defs/string_array"}
      }
    },
    "claim": {
      "oneOf": [
        {"$ref": "#/$defs/bounded_string"},
        {
          "type": "object",
          "additionalProperties": false,
          "minProperties": 1,
          "properties": {
            "claim_id": {"$ref": "#/$defs/slug_id"},
            "statement": {"$ref": "#/$defs/bounded_string"},
            "source": {"$ref": "#/$defs/bounded_string"},
            "confidence": {"type": "number", "minimum": 0, "maximum": 1},
            "notes": {"$ref": "#/$defs/bounded_string"}
          }
        }
      ]
    },
    "evidence": {
      "type": "object",
      "additionalProperties": false,
      "required": ["authored_original", "claims"],
      "properties": {
        "authored_original": {"type": "boolean"},
        "claims": {
          "type": "array",
          "maxItems": 256,
          "items": {"$ref": "#/$defs/claim"}
        }
      }
    },
    "trait_map": {
      "type": "object",
      "maxProperties": 128,
      "additionalProperties": false,
      "propertyNames": {"$ref": "#/$defs/semantic_id"},
      "patternProperties": {
        "^[a-z][a-z0-9]*(?:_[a-z0-9]+)*(?![\\s\\S])": {
          "type": "number",
          "minimum": 0,
          "maximum": 1
        }
      }
    },
    "derived_profile": {
      "type": "object",
      "additionalProperties": false,
      "required": ["method_version", "traits"],
      "properties": {
        "method_version": {"$ref": "#/$defs/bounded_string"},
        "traits": {
          "allOf": [
            {"$ref": "#/$defs/trait_map"},
            {"minProperties": 1}
          ]
        }
      }
    },
    "overrides": {
      "type": "object",
      "additionalProperties": false,
      "properties": {
        "values": {"$ref": "#/$defs/trait_map"}
      }
    },
    "intensity": {
      "enum": ["neutral", "subtle", "balanced", "immersive", "performance"]
    },
    "behavior": {
      "type": "object",
      "additionalProperties": false,
      "required": ["default_intensity"],
      "properties": {
        "default_intensity": {"$ref": "#/$defs/intensity"},
        "catchphrase_frequency": {"$ref": "#/$defs/bounded_string"},
        "correction_style": {"$ref": "#/$defs/bounded_string"},
        "reassurance_style": {"$ref": "#/$defs/bounded_string"},
        "closing_expressions": {
          "type": "array",
          "maxItems": 256,
          "uniqueItems": true,
          "items": {"$ref": "#/$defs/semantic_id"}
        }
      }
    },
    "stage_thresholds": {
      "type": "object",
      "additionalProperties": false,
      "minProperties": 1,
      "properties": {
        "enter_familiarity": {"type": "number", "minimum": 0, "maximum": 100},
        "exit_familiarity": {"type": "number", "minimum": 0, "maximum": 100},
        "enter_trust": {"type": "number", "minimum": 0, "maximum": 100},
        "exit_trust": {"type": "number", "minimum": 0, "maximum": 100},
        "max_tension": {"type": "number", "minimum": 0, "maximum": 100},
        "exit_max_tension": {"type": "number", "minimum": 0, "maximum": 100}
      }
    },
    "growth": {
      "type": "object",
      "additionalProperties": false,
      "required": ["dimensions"],
      "properties": {
        "dimensions": {
          "type": "array",
          "minItems": 1,
          "maxItems": 4,
          "uniqueItems": true,
          "items": {
            "enum": ["familiarity", "trust", "collaboration", "tension"]
          }
        },
        "max_delta_per_event": {
          "type": "number",
          "exclusiveMinimum": 0,
          "maximum": 100
        },
        "repetition_window_turns": {
          "type": "integer",
          "minimum": 1,
          "maximum": 10000
        },
        "stages": {
          "type": "object",
          "minProperties": 1,
          "maxProperties": 4,
          "additionalProperties": false,
          "properties": {
            "unknown": {"$ref": "#/$defs/stage_thresholds"},
            "acquainted": {"$ref": "#/$defs/stage_thresholds"},
            "familiar": {"$ref": "#/$defs/stage_thresholds"},
            "trusted": {"$ref": "#/$defs/stage_thresholds"}
          }
        }
      }
    },
    "expression_lines": {
      "type": "array",
      "minItems": 1,
      "maxItems": 32,
      "items": {
        "type": "string",
        "minLength": 1,
        "maxLength": 500
      }
    },
    "expression_locale_set": {
      "type": "object",
      "additionalProperties": false,
      "minProperties": 1,
      "maxProperties": 64,
      "patternProperties": {
        "^[a-z]{2,3}(-[A-Z][a-z]{3})?(-([A-Z]{2}|[0-9]{3}))?$": {"$ref": "#/$defs/expression_lines"}
      }
    },
    "expressions": {
      "type": "object",
      "minProperties": 1,
      "maxProperties": 256,
      "additionalProperties": false,
      "propertyNames": {"$ref": "#/$defs/semantic_id"},
      "patternProperties": {
        "^[a-z][a-z0-9]*(?:_[a-z0-9]+)*(?![\\s\\S])": {
          "$ref": "#/$defs/expression_locale_set"
        }
      }
    },
    "relationship_stage_map": {
      "type": "object",
      "additionalProperties": false,
      "properties": {
        "unknown": {"type": ["string", "null"], "maxLength": 128},
        "acquainted": {"type": ["string", "null"], "maxLength": 128},
        "familiar": {"type": ["string", "null"], "maxLength": 128},
        "trusted": {"type": ["string", "null"], "maxLength": 128}
      }
    },
    "locale_config": {
      "type": "object",
      "additionalProperties": false,
      "properties": {
        "register": {"$ref": "#/$defs/bounded_string"},
        "sentence_length": {"$ref": "#/$defs/bounded_string"},
        "technical_terms": {"$ref": "#/$defs/bounded_string"},
        "addressing": {"$ref": "#/$defs/relationship_stage_map"},
        "politeness": {"$ref": "#/$defs/relationship_stage_map"}
      }
    },
    "locales": {
      "type": "object",
      "additionalProperties": false,
      "minProperties": 1,
      "maxProperties": 64,
      "patternProperties": {
        "^[a-z]{2,3}(-[A-Z][a-z]{3})?(-([A-Z]{2}|[0-9]{3}))?$": {"$ref": "#/$defs/locale_config"}
      }
    },
    "scenario": {
      "type": "object",
      "additionalProperties": false,
      "properties": {
        "first_action": {"$ref": "#/$defs/bounded_string"},
        "hypothesis_style": {"$ref": "#/$defs/bounded_string"},
        "correction_style": {"$ref": "#/$defs/bounded_string"},
        "reassurance": {"$ref": "#/$defs/bounded_string"},
        "intensity_cap": {"$ref": "#/$defs/intensity"}
      }
    },
    "scenarios": {
      "type": "object",
      "minProperties": 1,
      "maxProperties": 128,
      "additionalProperties": false,
      "propertyNames": {"$ref": "#/$defs/semantic_id"},
      "patternProperties": {
        "^[a-z][a-z0-9]*(?:_[a-z0-9]+)*(?![\\s\\S])": {"$ref": "#/$defs/scenario"}
      }
    }
  }
}
